{"$schema":"https://json-schema.org/draft/2020-12/schema","type":"object","additionalProperties":false,"properties":{"registryVersion":{"const":5},"specId":{"const":"SPEC-0001"},"authorizationId":{"const":"phase-5/v1"},"operationFamilies":{"const":["guarded-http","runner-environment"]},"cases":{"type":"array","minItems":1,"uniqueItems":true,"items":{"type":"object","additionalProperties":false,"properties":{"caseId":{"type":"string"},"operationKind":{"enum":["marked-availability-get","marked-raw-stick-post","marker-free-drawing-fallthrough-post"]},"request":{"type":"object","additionalProperties":false,"properties":{"method":{"enum":["GET","POST"]},"path":{"const":"/api/ai"},"headers":{"type":"array","items":{"type":"array","prefixItems":[{"type":"string"},{"type":"string"}],"minItems":2,"maxItems":2}},"body":{"type":"object","additionalProperties":false,"properties":{"encoding":{"const":"base64"},"byteLength":{"type":"integer","minimum":0},"sha256":{"type":"string","pattern":"^sha256:[0-9a-f]{64}$"},"data":{"type":"string"}},"required":["encoding","byteLength","sha256","data"]}},"required":["method","path","headers","body"]},"expected":{"type":"object","additionalProperties":false,"properties":{"outcome":{"enum":["exact-response","legacy-fallthrough"]},"status":{"type":"integer","minimum":100,"maximum":599},"headers":{"type":"array","items":{"type":"array","prefixItems":[{"type":"string"},{"type":"string"}],"minItems":2,"maxItems":2}},"body":{"anyOf":[{"type":"null"},{"type":"object","additionalProperties":false,"properties":{"byteLength":{"type":"integer","minimum":0},"sha256":{"type":"string","pattern":"^sha256:[0-9a-f]{64}$"}},"required":["byteLength","sha256"]}]},"legacyCheckpoint":{"anyOf":[{"type":"null"},{"type":"object","additionalProperties":false,"properties":{"checkpointKind":{"type":"string"},"expectedJsonFields":{"type":"object"}},"required":["checkpointKind","expectedJsonFields"]}]},"logAssertions":{"type":"object","additionalProperties":false,"properties":{"forbiddenSubstrings":{"type":"array","items":{"type":"string"}},"rawBodyMustNotAppear":{"const":true}},"required":["forbiddenSubstrings","rawBodyMustNotAppear"]},"nonLoopbackAttempts":{"const":0}},"required":["outcome","status","headers","body","legacyCheckpoint","logAssertions","nonLoopbackAttempts"]}},"required":["caseId","operationKind","request","expected"]}}},"required":["registryVersion","specId","authorizationId","operationFamilies","cases"]}
