{
  "registryVersion": 5,
  "specId": "SPEC-0001",
  "authorizationId": "phase-5/v1",
  "operationFamilies": [
    "guarded-http",
    "runner-environment"
  ],
  "cases": [
    {
      "caseId": "availability-marked-mock",
      "operationKind": "marked-availability-get",
      "request": {
        "method": "GET",
        "path": "/api/ai",
        "headers": [
          [
            "connection",
            "close"
          ],
          [
            "host",
            "phase5.invalid"
          ],
          [
            "x-diamond-ai-workspace",
            "stick-figure"
          ]
        ],
        "body": {
          "encoding": "base64",
          "byteLength": 0,
          "sha256": "sha256:e3b0c44298fc1c149afbf4c8996fb92427ae41e4649b934ca495991b7852b855",
          "data": ""
        }
      },
      "expected": {
        "outcome": "exact-response",
        "status": 200,
        "headers": [
          [
            "cache-control",
            "no-store"
          ],
          [
            "content-type",
            "application/json"
          ]
        ],
        "body": {
          "byteLength": 39,
          "sha256": "sha256:8d907dbd30dcb2c27937a06e6064483bad75a8b76869c2f6a9cda114b6aaaf86"
        },
        "legacyCheckpoint": null,
        "logAssertions": {
          "forbiddenSubstrings": [
            "PHASE5_PRIVATE_SENTINEL",
            "PHASE5_DRAWING_SENTINEL",
            "OPENAI_API_KEY",
            "SUPABASE_SERVICE_ROLE_KEY"
          ],
          "rawBodyMustNotAppear": true
        },
        "nonLoopbackAttempts": 0
      }
    },
    {
      "caseId": "availability-unmarked-rejected",
      "operationKind": "marked-availability-get",
      "request": {
        "method": "GET",
        "path": "/api/ai",
        "headers": [
          [
            "connection",
            "close"
          ],
          [
            "host",
            "phase5.invalid"
          ]
        ],
        "body": {
          "encoding": "base64",
          "byteLength": 0,
          "sha256": "sha256:e3b0c44298fc1c149afbf4c8996fb92427ae41e4649b934ca495991b7852b855",
          "data": ""
        }
      },
      "expected": {
        "outcome": "exact-response",
        "status": 405,
        "headers": [
          [
            "cache-control",
            "no-store"
          ],
          [
            "content-type",
            "application/json"
          ]
        ],
        "body": {
          "byteLength": 89,
          "sha256": "sha256:7e1aa2cba91fa14cc8a05b8a47ef0ed2dc952365be871361d3f6861a7c435f76"
        },
        "legacyCheckpoint": null,
        "logAssertions": {
          "forbiddenSubstrings": [
            "PHASE5_PRIVATE_SENTINEL",
            "PHASE5_DRAWING_SENTINEL",
            "OPENAI_API_KEY",
            "SUPABASE_SERVICE_ROLE_KEY"
          ],
          "rawBodyMustNotAppear": true
        },
        "nonLoopbackAttempts": 0
      }
    },
    {
      "caseId": "availability-wrong-marker-rejected",
      "operationKind": "marked-availability-get",
      "request": {
        "method": "GET",
        "path": "/api/ai",
        "headers": [
          [
            "connection",
            "close"
          ],
          [
            "host",
            "phase5.invalid"
          ],
          [
            "x-diamond-ai-workspace",
            "drawing"
          ]
        ],
        "body": {
          "encoding": "base64",
          "byteLength": 0,
          "sha256": "sha256:e3b0c44298fc1c149afbf4c8996fb92427ae41e4649b934ca495991b7852b855",
          "data": ""
        }
      },
      "expected": {
        "outcome": "exact-response",
        "status": 405,
        "headers": [
          [
            "cache-control",
            "no-store"
          ],
          [
            "content-type",
            "application/json"
          ]
        ],
        "body": {
          "byteLength": 89,
          "sha256": "sha256:7e1aa2cba91fa14cc8a05b8a47ef0ed2dc952365be871361d3f6861a7c435f76"
        },
        "legacyCheckpoint": null,
        "logAssertions": {
          "forbiddenSubstrings": [
            "PHASE5_PRIVATE_SENTINEL",
            "PHASE5_DRAWING_SENTINEL",
            "OPENAI_API_KEY",
            "SUPABASE_SERVICE_ROLE_KEY"
          ],
          "rawBodyMustNotAppear": true
        },
        "nonLoopbackAttempts": 0
      }
    },
    {
      "caseId": "valid-marked-mock",
      "operationKind": "marked-raw-stick-post",
      "request": {
        "method": "POST",
        "path": "/api/ai",
        "headers": [
          [
            "connection",
            "close"
          ],
          [
            "content-length",
            "1405"
          ],
          [
            "content-type",
            "application/json"
          ],
          [
            "host",
            "phase5.invalid"
          ],
          [
            "x-diamond-ai-workspace",
            "stick-figure"
          ]
        ],
        "body": {
          "encoding": "base64",
          "byteLength": 1405,
          "sha256": "sha256:4c52772bb53533105653f9847675258b015a8d1d43a711c50a510d3a54c269db",
          "data": "eyJraW5kIjoic3RpY2stYWktcmVxdWVzdCIsInJlcXVlc3RWZXJzaW9uIjoxLCJyZXF1ZXN0SWQiOiIwMDAwMDAwMC0wMDAwLTQwMDAtODAwMC0wMDAwMDAwMDA1MDEiLCJ0cmFuc2FjdGlvbklkIjoiMDAwMDAwMDAtMDAwMC00MDAwLTgwMDAtMDAwMDAwMDAwNTAyIiwid29ya3NwYWNlVHlwZSI6InN0aWNrLWZpZ3VyZSIsInByb21wdCI6IkNyZWF0ZSBhIHNpbXBsZSB0aHJlZS1wb3NlIHdhdmUgYW5pbWF0aW9uIHdpdGggb25lIHN0aWNrIGZpZ3VyZSBhdCAxMiBGUFMuIiwiY2FwYWJpbGl0eU1hbmlmZXN0Ijp7Im1hbmlmZXN0VmVyc2lvbiI6MSwiY2FwYWJpbGl0aWVzIjpbInN0aWNrLnBvc2Utc2VxdWVuY2UuY3JlYXRlL3YxIl0sInByb21wdEludGVudFZlcnNpb24iOjEsImxpbWl0cyI6eyJtYXhBY3Rpb25zIjoxLCJtYXhSaWdzIjoxLCJtYXhGaWd1cmVzIjoxLCJtYXhUYXJnZXRMYXllcnMiOjEsIm1heEtleVBvc2VzIjozLCJtYXhUaW1lbGluZUZyYW1lcyI6MTIsImpvaW50c1BlclBvc2UiOjExLCJzZWdtZW50c1BlclJpZyI6MTAsImFsbG93ZWRGcHMiOlsxMl0sInByb21wdEJ5dGVzIjoxMjgsInJlcXVlc3RCeXRlcyI6MTYzODQsInByb3ZpZGVyUGxhbkJ5dGVzIjo4MTkyLCJjb21tYW5kQnl0ZXMiOjMyNzY4LCJjb29yZGluYXRlU3BhY2UiOiJzdGljay1zdGFnZS0xOTIweDEwODAtdjEiLCJzZWFyY2giOiJkaXNhYmxlZCIsInRvb2xzIjoiZGlzYWJsZWQifX0sInByb2plY3RDb250ZXh0Ijp7ImtpbmQiOiJzdGljay1wcm9qZWN0LWNvbnRleHQiLCJjb250ZXh0VmVyc2lvbiI6MSwic2NoZW1hVmVyc2lvbiI6MSwicHJvamVjdElkIjoiMDAwMDAwMDAtMDAwMC00MDAwLTgwMDAtMDAwMDAwMDAwMDAxIiwiZG9jdW1lbnRSZXZpc2lvbiI6MCwiYmFzZURvY3VtZW50RGlnZXN0Ijoic2hhMjU2OjgxYjhlOWIxODNhZjFhMTk4YjFiYjUxMmM4NzI2OTE5YWRlMGE3NjRmZmZmZTM4ZTFkNzc5NjRhZWZmODhiMmIiLCJ3b3Jrc3BhY2VUeXBlIjoic3RpY2stZmlndXJlIiwid2F2ZVN0YXJ0ZXJFbGlnaWJsZSI6dHJ1ZSwiY29vcmRpbmF0ZVNwYWNlIjoic3RpY2stc3RhZ2UtMTkyMHgxMDgwLXYxIiwiZnBzIjoxMiwiYWN0aXZlTGF5ZXJJZCI6IjAwMDAwMDAwLTAwMDAtNDAwMC04MDAwLTAwMDAwMDAwMDAwNCIsImxheWVyQ291bnQiOjEsInRhcmdldFJpZ0lkIjoiMDAwMDAwMDAtMDAwMC00MDAwLTgwMDAtMDAwMDAwMDAwMDAyIiwidGFyZ2V0RmlndXJlSWQiOiIwMDAwMDAwMC0wMDAwLTQwMDAtODAwMC0wMDAwMDAwMDAwMDMiLCJzdGFydGVyUG9zZUlkIjoiMDAwMDAwMDAtMDAwMC00MDAwLTgwMDAtMDAwMDAwMDAwNDAxIiwiZmlndXJlQ291bnQiOjEsImF1dGhvcmVkUG9zZUNvdW50IjoxLCJ0aW1lbGluZUZyYW1lQ291bnQiOjEyLCJlbXB0eUNlbGxDb3VudCI6MTF9fQ=="
        }
      },
      "expected": {
        "outcome": "exact-response",
        "status": 200,
        "headers": [
          [
            "cache-control",
            "no-store"
          ],
          [
            "content-type",
            "application/json"
          ]
        ],
        "body": {
          "byteLength": 4163,
          "sha256": "sha256:b7b3fb757476a6e425cc8829359bb1a4fdae889a23cfded5c920782449c58006"
        },
        "legacyCheckpoint": null,
        "logAssertions": {
          "forbiddenSubstrings": [
            "PHASE5_PRIVATE_SENTINEL",
            "PHASE5_DRAWING_SENTINEL",
            "OPENAI_API_KEY",
            "SUPABASE_SERVICE_ROLE_KEY"
          ],
          "rawBodyMustNotAppear": true
        },
        "nonLoopbackAttempts": 0
      }
    },
    {
      "caseId": "header-body-marker-mismatch",
      "operationKind": "marked-raw-stick-post",
      "request": {
        "method": "POST",
        "path": "/api/ai",
        "headers": [
          [
            "connection",
            "close"
          ],
          [
            "content-length",
            "36"
          ],
          [
            "content-type",
            "application/json"
          ],
          [
            "host",
            "phase5.invalid"
          ],
          [
            "x-diamond-ai-workspace",
            "stick-figure"
          ]
        ],
        "body": {
          "encoding": "base64",
          "byteLength": 36,
          "sha256": "sha256:2c1904105fa19e038838555624e3ca093ec3179640eba0574d4aa04323f29515",
          "data": "eyJwcm9tcHQiOiJQSEFTRTVfUFJJVkFURV9TRU5USU5FTCJ9"
        }
      },
      "expected": {
        "outcome": "exact-response",
        "status": 400,
        "headers": [
          [
            "cache-control",
            "no-store"
          ],
          [
            "content-type",
            "application/json"
          ]
        ],
        "body": {
          "byteLength": 89,
          "sha256": "sha256:7e1aa2cba91fa14cc8a05b8a47ef0ed2dc952365be871361d3f6861a7c435f76"
        },
        "legacyCheckpoint": null,
        "logAssertions": {
          "forbiddenSubstrings": [
            "PHASE5_PRIVATE_SENTINEL",
            "PHASE5_DRAWING_SENTINEL",
            "OPENAI_API_KEY",
            "SUPABASE_SERVICE_ROLE_KEY"
          ],
          "rawBodyMustNotAppear": true
        },
        "nonLoopbackAttempts": 0
      }
    },
    {
      "caseId": "body-marker-missing-header",
      "operationKind": "marked-raw-stick-post",
      "request": {
        "method": "POST",
        "path": "/api/ai",
        "headers": [
          [
            "connection",
            "close"
          ],
          [
            "content-length",
            "1405"
          ],
          [
            "content-type",
            "application/json"
          ],
          [
            "host",
            "phase5.invalid"
          ]
        ],
        "body": {